{
  "browser_session_schema_version": "oa_browser_session.v1",
  "session_id": "session-slice-0232",
  "status": "ACTIVE",
  "issuer": "nex-oa",
  "audience": "nex-ae-api",
  "token_use": "user",
  "tenant_ref": {
    "type": "oa.tenant",
    "id": "tenant-local"
  },
  "subject_ref": {
    "type": "oa.user",
    "id": "user-local"
  },
  "scopes": [
    "workspace:use",
    "documents:upload"
  ],
  "roles": [
    "employee"
  ],
  "issued_at": "2026-08-12T00:00:00Z",
  "expires_at": "2026-08-12T01:00:00Z",
  "auth_time": "2026-08-12T00:00:00Z",
  "metadata": {
    "raw_token_included": false,
    "service_token_included": false,
    "password_included": false,
    "browser_payload_owner_authoritative": false,
    "claim_owner_authoritative": true
  }
}
